{
  "$schema": "http://json-schema.org/draft-07/schema#",
  "$comment": "GENERATED by gui/schema-gen/derive_nf_config_schemas.py from config/oam-gui-bff.json + its source (ADR-0425). Do not edit; regenerate.",
  "title": "oam-gui-bff",
  "type": "object",
  "additionalProperties": false,
  "properties": {
    "port": {
      "type": "integer",
      "x-cpp-type": "unsigned short"
    },
    "bind_address": {
      "type": "string",
      "x-env-override": "OAM_GUI_BFF_BIND_ADDRESS",
      "x-cpp-type": "std::string"
    },
    "metrics_bind_address": {
      "type": "string",
      "x-env-override": "OAM_GUI_BFF_METRICS_BIND_ADDRESS",
      "x-cpp-type": "std::string"
    },
    "product_catalog_base_url": {
      "type": "string",
      "x-env-override": "OAM_GUI_BFF_PRODUCT_CATALOG_BASE_URL",
      "x-cpp-type": "std::string"
    },
    "provisioning_base_url": {
      "type": "string",
      "x-env-override": "OAM_GUI_BFF_PROVISIONING_BASE_URL",
      "x-cpp-type": "std::string"
    },
    "static_dir": {
      "type": "string",
      "x-env-override": "OAM_GUI_BFF_STATIC_DIR",
      "x-cpp-type": "std::string"
    },
    "server_cert_path": {
      "type": "string",
      "x-env-override": "OAM_GUI_BFF_SERVER_CERT_PATH",
      "x-cpp-type": "std::string"
    },
    "server_key_path": {
      "type": "string",
      "x-env-override": "OAM_GUI_BFF_SERVER_KEY_PATH",
      "x-cpp-type": "std::string"
    },
    "operator_ca_path": {
      "type": "string",
      "x-env-override": "OAM_GUI_BFF_OPERATOR_CA_PATH",
      "x-cpp-type": "std::string"
    },
    "client_cert_path": {
      "type": "string",
      "x-env-override": "OAM_GUI_BFF_CLIENT_CERT_PATH",
      "x-cpp-type": "std::string"
    },
    "client_key_path": {
      "type": "string",
      "x-env-override": "OAM_GUI_BFF_CLIENT_KEY_PATH",
      "x-cpp-type": "std::string"
    },
    "service_ca_path": {
      "type": "string",
      "x-env-override": "OAM_GUI_BFF_SERVICE_CA_PATH",
      "x-cpp-type": "std::string"
    },
    "iam_database_url": {
      "type": "string",
      "x-env-override": "OAM_GUI_BFF_IAM_DATABASE_URL",
      "x-cpp-type": "std::string",
      "x-sensitivity": "credential"
    },
    "iam_db_pool_size": {
      "type": "integer",
      "x-env-override": "OAM_GUI_BFF_IAM_DB_POOL_SIZE",
      "x-cpp-type": "int"
    },
    "audit_chain_key": {
      "type": "string",
      "x-env-override": "OAM_GUI_BFF_AUDIT_CHAIN_KEY",
      "x-cpp-type": "std::string"
    },
    "oidc": {
      "type": "object",
      "additionalProperties": false,
      "properties": {
        "issuer": {
          "type": "string"
        },
        "authorization_endpoint": {
          "type": "string"
        },
        "token_endpoint": {
          "type": "string"
        },
        "jwks_uri": {
          "type": "string"
        },
        "end_session_endpoint": {
          "type": "string"
        },
        "client_id": {
          "type": "string"
        },
        "client_secret_file": {
          "type": "string"
        },
        "redirect_uri": {
          "type": "string"
        },
        "post_logout_redirect_uri": {
          "type": "string"
        },
        "idp_ca_path": {
          "type": "string"
        },
        "acr_values": {
          "type": "string"
        },
        "mfa_amr": {
          "type": "array",
          "items": {
            "type": "string"
          }
        },
        "mfa_acr": {
          "type": "array",
          "items": {
            "type": "string"
          }
        }
      },
      "x-cpp-type": "nlohmann::json"
    },
    "nf_config": {
      "type": "object",
      "additionalProperties": false,
      "properties": {
        "config_dir": {
          "type": "string"
        },
        "schema_dir": {
          "type": "string"
        },
        "editable": {
          "type": "array",
          "items": {
            "type": "string"
          }
        }
      },
      "x-cpp-type": "nlohmann::json"
    }
  },
  "required": [
    "audit_chain_key",
    "bind_address",
    "client_cert_path",
    "client_key_path",
    "iam_database_url",
    "iam_db_pool_size",
    "metrics_bind_address",
    "nf_config",
    "oidc",
    "operator_ca_path",
    "port",
    "product_catalog_base_url",
    "provisioning_base_url",
    "server_cert_path",
    "server_key_path",
    "service_ca_path",
    "static_dir"
  ],
  "x-config-file": "config/oam-gui-bff.json",
  "x-source": [
    "gui/bff"
  ],
  "x-apply": "restart",
  "x-review": [
    "oidc: nested object shape inferred from current values (map-vs-struct meaning unverified; new keys refused until reviewed)",
    "nf_config: nested object shape inferred from current values (map-vs-struct meaning unverified; new keys refused until reviewed)"
  ]
}
